{
  "schema_version": 1,
  "kind": "compatibility",
  "result": "PASS",
  "project": "example-project",
  "candidate_bundle_sha256": "sha256:1111111111111111111111111111111111111111111111111111111111111111",
  "candidate_manifest_sha256": "sha256:2222222222222222222222222222222222222222222222222222222222222222",
  "control_commit": "4444444444444444444444444444444444444444",
  "checks": [
    {
      "name": "isolated compatibility suite",
      "result": "PASS",
      "evidence_sha256": "sha256:5555555555555555555555555555555555555555555555555555555555555555"
    }
  ]
}
